{
  "format": "nightshift.observations/v0",
  "replay": {
    "sha256": "cccccccccccccccccccccccccccccccccccccccccccccccccccccccccccccccc"
  },
  "model": {
    "name": "nightshift.trace-synthetic",
    "prompts": {
      "player": "small robot character",
      "ground": "grass-topped ground"
    }
  },
  "frames": [
    {
      "frame": 0,
      "objects": {
        "player": [
          {
            "box": [
              760,
              660,
              830,
              778
            ],
            "score": 0.94,
            "track": 1
          }
        ],
        "ground": [
          {
            "box": [
              350,
              770,
              1600,
              960
            ],
            "score": 0.9,
            "track": 2
          }
        ]
      }
    },
    {
      "frame": 40,
      "objects": {
        "player": [
          {
            "box": [
              760,
              660,
              830,
              778
            ],
            "score": 0.94,
            "track": 1
          }
        ],
        "ground": [
          {
            "box": [
              350,
              770,
              1600,
              960
            ],
            "score": 0.9,
            "track": 2
          }
        ]
      }
    },
    {
      "frame": 80,
      "objects": {
        "player": [
          {
            "box": [
              760,
              660,
              830,
              778
            ],
            "score": 0.94,
            "track": 1
          }
        ],
        "ground": [
          {
            "box": [
              350,
              770,
              1600,
              960
            ],
            "score": 0.9,
            "track": 2
          }
        ]
      }
    }
  ]
}
