{
  "format": "expectrail.observations/v0",
  "replay": {
    "sha256": "bbbbbbbbbbbbbbbbbbbbbbbbbbbbbbbbbbbbbbbbbbbbbbbbbbbbbbbbbbbbbbbb"
  },
  "model": {
    "name": "expectrail.trace-synthetic",
    "prompts": {
      "player": "small robot character",
      "ground": "grass-topped ground"
    }
  },
  "frames": [
    {
      "frame": 0,
      "objects": {
        "player": [
          {
            "box": [
              760,
              660,
              830,
              778
            ],
            "score": 0.94,
            "track": 1
          }
        ],
        "ground": [
          {
            "box": [
              350,
              770,
              1600,
              960
            ],
            "score": 0.9,
            "track": 2
          }
        ]
      }
    },
    {
      "frame": 8,
      "objects": {
        "player": [
          {
            "box": [
              770,
              700,
              840,
              820
            ],
            "score": 0.92,
            "track": 1
          }
        ],
        "ground": [
          {
            "box": [
              350,
              770,
              1600,
              960
            ],
            "score": 0.9,
            "track": 2
          }
        ]
      }
    },
    {
      "frame": 16,
      "objects": {
        "player": [
          {
            "box": [
              775,
              820,
              845,
              940
            ],
            "score": 0.81,
            "track": 1
          }
        ],
        "ground": [
          {
            "box": [
              350,
              770,
              1600,
              960
            ],
            "score": 0.9,
            "track": 2
          }
        ]
      }
    }
  ]
}
